name,display_name,description,variable_type,database,unit,deleted,version
ST90CV,Volume (Cortical Parcellation) of RightInferiorParietal,,numerical,ADNI,,,
ST47TA,Cortical Thickness Average of LeftParsTriangularis,,numerical,ADNI,,,
ST106TA,Cortical Thickness Average of RightParsTriangularis,,numerical,ADNI,,,
ST46TA,Cortical Thickness Average of LeftParsOrbitalis,,numerical,ADNI,,,
ST105TA,Cortical Thickness Average of RightParsOrbitalis,,numerical,ADNI,,,
ST49TA,Cortical Thickness Average of LeftPostcentral,,numerical,ADNI,,,
ST51TA,Cortical Thickness Average of LeftPrecentral,,numerical,ADNI,,,
ST48TA,Cortical Thickness Average of LeftPericalcarine,,numerical,ADNI,,,
ST108TA,Cortical Thickness Average of RightPostcentral,,numerical,ADNI,,,
ST110TA,Cortical Thickness Average of RightPrecentral,,numerical,ADNI,,,
ST24TA,Cortical Thickness Average of LeftEntorhinal,,numerical,ADNI,,,
ST23TA,Cortical Thickness Average of LeftCuneus,,numerical,ADNI,,,
ST107TA,Cortical Thickness Average of RightPericalcarine,,numerical,ADNI,,,
ST59TA,Cortical Thickness Average of LeftSupramarginal,,numerical,ADNI,,,
ST83TA,Cortical Thickness Average of RightEntorhinal,,numerical,ADNI,,,
ST82TA,Cortical Thickness Average of RightCuneus,,numerical,ADNI,,,
ST118TA,Cortical Thickness Average of RightSupramarginal,,numerical,ADNI,,,
ST43TA,Cortical Thickness Average of LeftParacentral,,numerical,ADNI,,,
ST102TA,Cortical Thickness Average of RightParacentral,,numerical,ADNI,,,
ST127SV,Volume (WM Parcellation) of ThirdVentricle,,numerical,ADNI,,,
WHITMATHYP,White matter hyperintensivity volume -- whole brain.,,numerical,ADNI,,,
TRACERTYPE,Amyloid Imaging radiotracer used,,categorical,ADNI,,,
T2TCV,T2 Total Intracranial Volume,,numerical,ADNI,,,
DXMPTR3,3. Normal general cognitive function,,categorical,ADNI,,,
